{
  "missionId": "mission-synthetic-0001",
  "proposalId": "proposal-synthetic-0001",
  "proposalDigest": "e3b6c8a4c2a075031275dc288bad3f780c992338617978dcb5863bc51aa6f761",
  "proposalVersion": 1,
  "evidenceDecisionId": "decision-synthetic-0001",
  "evidenceDecisionDigest": "3c3775801fc324695e0f1eca64cf8fa91d6f213eec7968c71ffe8db61ce6abe3",
  "evidenceDecisionVersion": 1,
  "decision": "approve",
  "action": {
    "commandType": "escalate-rescue",
    "droneId": "drone-synthetic-01",
    "latitudeMicrodegrees": 45123456,
    "longitudeMicrodegrees": -75123456
  }
}
